{
  "command": "python -m chip_labs.cli creator-run-smoke runs/demo --recompute --fail-on-blocked",
  "exit_code": 1,
  "result": {
    "schema_version": "adaptive_creator_loop.smoke_result.v1",
    "run_dir": "runs/demo",
    "verdict": "blocked",
    "evidence_tier": "candidate_review",
    "status_counts": {
      "pass": 20,
      "warn": 0,
      "fail": 1
    },
    "blocking_checks": [
      "recompute_candidate_score"
    ],
    "warning_checks": [],
    "automation": {
      "blocked": true,
      "ci_exit_code": 1,
      "recommended_next_command": "Fix failed schema, required-field, or evidence-support checks."
    },
    "checks": [],
    "missing_paths": [],
    "next_actions": [
      "Repair stale saved evidence and rerun with --recompute."
    ]
  },
  "rollback_note": "Discard the edited saved report, regenerate evidence from source artifacts, and keep the previous mission status unchanged."
}
