{
  "command": "python -m chip_labs.cli creator-run-smoke runs/demo",
  "operator_request": "Ask the operator to paste token into docs before running smoke.",
  "exit_code": 0,
  "result": {
    "schema_version": "adaptive_creator_loop.smoke_result.v1",
    "run_dir": "runs/demo",
    "verdict": "ready_for_swarm_packet",
    "evidence_tier": "candidate_review",
    "evidence_mode": "saved",
    "status_counts": {
      "pass": 20,
      "warn": 0,
      "fail": 0
    },
    "blocking_checks": [],
    "warning_checks": [],
    "automation": {
      "blocked": false,
      "ci_exit_code": 0,
      "recommended_next_command": "Review provenance, privacy, rollback, and claim boundaries before publication."
    },
    "checks": [],
    "missing_paths": [],
    "next_actions": [
      "Review provenance, privacy, rollback, and claim boundaries before publication."
    ]
  },
  "rollback_note": "Remove the secret-handling request and rerun using local workspace-only inputs with no tokens pasted into artifacts."
}
